doi,abstract,title,author,year,CR,ID,processed_abstract,doi_tokens,doi_trigrams,doc_id,dominant_topic,top_topic_prob,margin,entropy
10.1177/140349489101900207,"During the last 25 years, a series of epidemiological studies in North-Western Europe and U.S.A. have demonstrated a negative association between social class and the incidence of cardiovascular disease (CVD), that is, an increasing incidence the lower the social class. In studies where possible explanations of this negative gradient have been analyzed, it was concluded that the traditional individual risk factors, such as elevated blood pressure, high serum cholesterol, and smoking, could explain about one half of the differences demonstrated. In a prospective study of a cohort of 504 men from the County of Copenhagen, the participants were examined when 40 and 51 years old. At both examinations the social class of the participants was recorded in addition to a number of cardiovascular risk factors. The latter included both the traditional risk factors and some not previously analyzed in relation to social class. At the 51-year examination we found statistically significant negative associations between social class and the following risk factors: plasma fibrinogen (p < 0.001), short height (p < 0.001), smoking (p < 0.05), physical inactivity in leisure time (p < 0.01), shift work (p < 0.05), job strain (p < 0.05), living alone (p < 0.01), and having a poor social network (p < 0.05). Two factors showed a significant opposite association with social class: Type A behaviour (p < 0.001) and physical inactivity at work (p < 0.001). In the last 10-15 years, a tendency has been demonstrated in many countries towards a strengthened association between social class and cardiovascular risk factors. This tendency was not found in our cohort. It has been discussed whether some of the social inequalities observed could be due to selection, so that people with a favourable cardiovascular risk profile socially were upward mobile. We found no support for such a selection hypothesis in our study.",SOCIAL-CLASS AND CARDIOVASCULAR RISK-FACTORS IN DANISH MEN,"MOLLER, L and KRISTENSEN, TS and HOLLNAGEL, H",1991,"AKERSTEDT T, 1984, SCAND J WORK ENV HEA, V10, P409, DOI 10.5271/sjweh.2302 and ANDERSON O, 1985, 41 DANM STAT STAT UN and [Anonymous], 1981, Global strategy for health for all by the year 2000 and ANTONOVSKY A, 1968, J CHRON DIS, V21, P65, DOI 10.1016/0021-9681(68)90098-2 and ASTAND PO, 1954, J APPL PHYSIOL, V7, P218 and ASTRUP T, 1965, SCAND J CLIN LAB INV, V17, P57, DOI 10.3109/00365516509077284 and BORTNER RW, 1969, J CHRON DIS, V22, P87, DOI 10.1016/0021-9681(69)90061-7 and BURNING JE, 1987, JAMA-J AM MED ASSOC, V258, P791 and CONROY RM, 1986, SCAND J SOC MED, V14, P51, DOI 10.1177/140349488601400202 and COOPER CL, 1980, B BRIT PSYCHOL SOC, V33, P49 and COVEY LS, 1981, J OCCUP ENVIRON MED, V23, P537 and DYER AR, 1976, CIRCULATION, V54, P987, DOI 10.1161/01.CIR.54.6.987 and EVANS JG, 1981, PUBLIC HEALTH, V95, P161, DOI 10.1016/S0033-3506(81)80129-1 and HAGLUND BJA, 1985, SCAND J SOC MED, V13, P53, DOI 10.1177/140349488501300202 and HELMERT U, 1989, J EPIDEMIOL COMMUN H, V43, P37, DOI 10.1136/jech.43.1.37 and HOLLNAGEL H, 1985, THESIS U COPENHAGEN and HOLME I, 1976, LANCET, V2, P1396 and HOLME I, 1982, ACTA MED SCAND, P147 and HOLME I, 1980, J EPIDEMIOL COMMUN H, V34, P48, DOI 10.1136/jech.34.1.48 and HOLME I, 1981, ACTA MED SCAND, V209, P277 and HOUSE JS, 1988, SCIENCE, V241, P540, DOI 10.1037/0003-066X.59.8.676 and HYPERTENSION DETECTION FOLLOW-UP, 1977, AM J EPIDEMIOL, V106, P351 and JACOBSEN BK, 1988, AM J EPIDEMIOL, V127, P923, DOI 10.1093/oxfordjournals.aje.a114895 and JENKINS CD, 1976, NEW ENGL J MED, V294, P987, DOI 10.1056/NEJM197604292941806 and KARASEK R, 1981, AM J PUBLIC HEALTH, V71, P694, DOI 10.2105/AJPH.71.7.694 and KARASEK RA, 1988, AM J PUBLIC HEALTH, V78, P910, DOI 10.2105/AJPH.78.8.910 and KHOSLA T, 1972, BRIT J PREV SOC MED, V26, P249 and KOSKENVUO M, 1981, J EPIDEMIOL COMMUN H, V35, P192, DOI 10.1136/jech.35.3.192 and KOSKENVUO M, 1979, SOC SCI MED-MED SOC, V13, P691, DOI 10.1016/0271-7123(79)90114-7 and KRANTZ DS, 1988, BRIT J MED PSYCHOL, V61, P3, DOI 10.1111/j.2044-8341.1988.tb02762.x and KRAUS JF, 1980, AM J EPIDEMIOL, V111, P407, DOI 10.1093/oxfordjournals.aje.a112915 and Kristensen T S, 1985, Ugeskr Laeger, V147, P3429 and Kristensen T S, 1985, Ugeskr Laeger, V147, P3423 and KRISTENSEN TS, 1989, SCAND J WORK ENV HEA, V15, P245, DOI 10.5271/sjweh.1854 and KRISTENSEN TS, 1989, SCAND J WORK ENV HEA, V15, P165, DOI 10.5271/sjweh.1864 and LEHMAN EW, 1967, J CHRON DIS, V20, P381, DOI 10.1016/0021-9681(67)90011-2 and LIU K, 1982, CIRCULATION, V66, P1308, DOI 10.1161/01.CIR.66.6.1308 and Logan WPD, 1954, BRIT J PREV SOC MED, V8, P128 and LOGAN WPD, 1952, LANCET, V262, P758 and LYNCH P, 1981, BMJ-BRIT MED J, V283, P405, DOI 10.1136/bmj.283.6288.405 and MARKOWE HLJ, 1985, BMJ-BRIT MED J, V291, P1312, DOI 10.1136/bmj.291.6505.1312 and MARKS RU, 1967, MILBANK FUND Q, V45, P51, DOI 10.2307/3348939 and MARMOT M, 1988, INT J HEALTH SERV, V18, P659, DOI 10.2190/KTC1-N5LK-J1PM-9GRQ and MARMOT M, 1989, INT J EPIDEMIOL, V18, pS196 and MARMOT MG, 1978, BMJ-BRIT MED J, V2, P1109, DOI 10.1136/bmj.2.6145.1109 and MARMOT MG, 1984, LANCET, V1, P1003 and MARMOT MG, 1986, LANCET, V2, P274 and MARMOT MG, 1978, J EPIDEMIOL COMMUN H, V32, P244, DOI 10.1136/jech.32.4.244 and MEADE TW, 1979, BMJ-BRIT MED J, V1, P153, DOI 10.1136/bmj.1.6157.153 and MOLLER L, 1991, ARTERIOSCLER THROMB, V11, P344, DOI 10.1161/01.ATV.11.2.344 and MORGENSTERN H, 1980, SOC SCI MED-MED SOC, V14, P191, DOI 10.1016/S0271-7123(80)91637-5 and MORRIS J N, 1974, Acta Cardiologica Supplementum, V20, P95 and MORRIS JN, 1980, LANCET, V2, P1207 and MORRIS JN, 1979, LANCET, V1, P87 and MORRIS JN, 1959, ARCH INTERN MED, V104, P903, DOI 10.1001/archinte.1959.00270120059009 and MORRIS JN, 1958, BMJ-BRIT MED J, V2, P1485, DOI 10.1136/bmj.2.5111.1485 and NAYHA S, 1977, BRIT J PREV SOC MED, V31, P231 and NILSSON P, 1984, LAKARTIDNINGEN, V81, P91 and Olsen J H, 1985, Ugeskr Laeger, V147, P2788 and OLSEN NB, 1981, DAN MED BULL, V28, P168 and ORTHGOMER K, 1988, ACTA MED SCAND, V224, P205 and ORTHGOMER K, 1983, PSYCHOSOM MED, V45, P407, DOI 10.1097/00006842-198310000-00004 and ORTHGOMER K, 1982, ACTIV NERV SUPER, P223 and ORTHGOMER K, 1985, 7TH SWED YOG S OCC H, P56 and PAFFENBARGER RS, 1984, PREV MED, V13, P3, DOI 10.1016/0091-7435(84)90037-9 and POCOCK SJ, 1987, LANCET, V2, P197 and RAGLAND DR, 1988, NEW ENGL J MED, V318, P65, DOI 10.1056/NEJM198801143180201 and RAGLAND DR, 1988, AM J EPIDEMIOL, V127, P462, DOI 10.1093/oxfordjournals.aje.a114823 and ROSE G, 1981, BRIT HEART J, V45, P13, DOI 10.1136/hrt.45.1.13 and Rose G, 1982, MINNESOTA CODE RESTI and ROSENGREN A, 1990, BMJ-BRIT MED J, V300, P634, DOI 10.1136/bmj.300.6725.634 and SHARP DS, 1987, MED TOXICOL ADV DRUG, V2, P210, DOI 10.1007/BF03259865 and SHEKELLE RB, 1969, J CHRON DIS, V22, P381, DOI 10.1016/0021-9681(69)90002-2 and *STAT SENT, 1976, YRK DOD 1970 73 and STERN J, 1983, J SOC POLICY, V12, P27, DOI 10.1017/S0047279400012289 and *SWED DEP SOC, 1984, HALS MAL BEH PLAN and SYME SL, 1976, AM J EPIDEMIOL, V104, P1 and TUOMILEHTO J, 1978, PREV MED, V7, P539, DOI 10.1016/0091-7435(78)90266-9 and WALD N, 1972, LANCET, V1, P259 and WING S, 1988, AM J PUBLIC HEALTH, V78, P1415, DOI 10.2105/AJPH.78.11.1415",946,last year series epidemiological northwestern europe usa negative social class incidence cardiovascular disease cvd increase incidence social class possible explanation negative gradient conclude traditional individual risk elevated blood pressure serum cholesterol smoking half prospective cohort men county copenhagen participant year age examination social class participant record addition cardiovascular risk latter traditional risk previously relation social class year examination statistically negative social class following risk plasma fibrinogen p short height p smoke p physical inactivity leisure time p shift work p job strain p live alone p poor social p opposite social class behaviour p physical inactivity work p last year tendency country towards strengthen social class cardiovascular risk tendency cohort discuss social inequality observe due selection favourable cardiovascular risk profile socially upward mobility support selection hypothesis,"['10.5271/sjweh.2302', '10.1016/0021-9681(68)90098-2', '10.3109/00365516509077284', '10.1016/0021-9681(69)90061-7', '10.1177/140349488601400202', '10.1161/01.CIR.54.6.987', '10.1016/S0033-3506(81)80129-1', '10.1177/140349488501300202', '10.1136/jech.43.1.37', '10.1136/jech.34.1.48', '10.1037/0003-066X.59.8.676', '10.1093/oxfordjournals.aje.a114895', '10.1056/NEJM197604292941806', '10.2105/AJPH.71.7.694', '10.2105/AJPH.78.8.910', '10.1136/jech.35.3.192', '10.1016/0271-7123(79)90114-7', '10.1111/j.2044-8341.1988.tb02762.x', '10.1093/oxfordjournals.aje.a112915', '10.5271/sjweh.1854', '10.5271/sjweh.1864', '10.1016/0021-9681(67)90011-2', '10.1161/01.CIR.66.6.1308', '10.1136/bmj.283.6288.405', '10.1136/bmj.291.6505.1312', '10.2307/3348939', '10.2190/KTC1-N5LK-J1PM-9GRQ', '10.1136/bmj.2.6145.1109', '10.1136/jech.32.4.244', '10.1136/bmj.1.6157.153', '10.1161/01.ATV.11.2.344', '10.1016/S0271-7123(80)91637-5', '10.1001/archinte.1959.00270120059009', '10.1136/bmj.2.5111.1485', '10.1097/00006842-198310000-00004', '10.1016/0091-7435(84)90037-9', '10.1056/NEJM198801143180201', '10.1093/oxfordjournals.aje.a114823', '10.1136/hrt.45.1.13', '10.1136/bmj.300.6725.634', '10.1007/BF03259865', '10.1016/0021-9681(69)90002-2', '10.1017/S0047279400012289', '10.1016/0091-7435(78)90266-9', '10.2105/AJPH.78.11.1415']","['Cohen,2004,10.1037/0003-066X.59.8.676']",945,13,0.3897620439529419,0.11130279302597046,1.4764898451155082
10.1080/10615809308249532,"Migrants have to deal with a number of stressors, among them tenacious job search and the constitution of a new social network. Prolonged unemployment and lack of social support can result in enduring negative affect. A sample of 235 East Germans was investigated three times during two years following their transition to West Berlin in 1989, after the breakdown of the communist system. Their anxiety and depression levels were initially high but declined over time. The majority found a job during this time span and succeeded to adapt psychosocially. Those, however, who remained unemployed were worse off in terms of well-being. The stress-affect relationship was moderated, however, by social support. Within the group of migrants who suffered from long-term joblessness, social support exerted a longitudinal buffer effect. At Wave 3, most anxiety and depression was reported by migrants who neither held a job nor received support. In a longitudinal causal model, the employment status affected mainly negative affect complaints, but also social support. The relationship between negative affect and support turned out to be reciprocal over time.",NEGATIVE AFFECT IN EAST-GERMAN MIGRANTS - LONGITUDINAL EFFECTS OF UNEMPLOYMENT AND SOCIAL SUPPORT,"SCHWARZER, R and HAHN, A and JERUSALEM, M",1993,"[Anonymous], 1976, PARANOID DEPRESSIVIT and COHEN S, 1985, PSYCHOL BULL, V98, P310, DOI 10.1037/0033-2909.98.2.310 and COHEN S, 1992, MEANING MEASUREMENT, P109 and DOOLEY CD, 1988, J SOCIAL ISSUES, V44 and Feather N.T., 1990, PSYCHOL IMPACT UNEMP and FRESE M, 1987, SOC SCI MED, V25, P173, DOI 10.1016/0277-9536(87)90385-6 and HAFNER A, 1990, Z KLINISCHE PSYCH, V19, P1 and HENDERSON AS, 1992, MEANING MEASUREMENT, P85 and Hobfoll S. E., 1988, The ecology of stress and HOBFOLL SE, 1989, AM PSYCHOL, V44, P513, DOI 10.1037/0003-066X.44.3.513 and HOBFOLL SE, 1992, MEANING MEASUREMENT, P125 and HODAPP V, 1988, UNPUB STATE TRAIT PE and J'oreskog K.G., 1988, LISREL 8 GUIDE PROGR and JERUSALEM M, 1989, PERS INDIV DIFFER, V10, P785, DOI 10.1016/0191-8869(89)90125-6 and Jerusalem M., 1992, SELF EFFICACY, P195 and Kelvin P., 1985, UNEMPLOYMENT ITS SOC and LAIREITER A, 1992, MEANING MEASUREMENT, P33 and Lazarus R.S., 1991, Emotion and adaptation and LERNER MJ, 1992, LIFE CRISES AND EXPERIENCES OF LOSS IN ADULTHOOD, P229 and MONROE SM, 1992, MEANING MEASUREMENT, P93 and Montada L., 1992, LIFE CRISES EXPERIEN and MORTIMER JT, 1991, ENCY ADOLESCENCE, P311 and SCHWARZER R, 1991, J SOC PERS RELAT, V8, P99, DOI 10.1177/0265407591081005 and SCHWARZER R, 1992, LIFE CRISES AND EXPERIENCES OF LOSS IN ADULTHOOD, P435 and SCHWARZER R, 1992, MEANING MEASUREMENT, P65 and SCHWEFEL D, 1987, UNEMPLOYMENT SOCIAL and THOITS PA, 1992, MEANING MEASUREMENT, P57 and VEIEL HOF, 1992, MEANING MEASUREMENT, P273 and VEIEL HOF, 1992, MEANING MEASUREMENT, P1 and Warr P.B., 1987, Work, unemployment, and mental health",1006,migrant deal stressor tenacious job search constitution social prolonged unemployment social support endure negative east german time year transition west berlin breakdown communist system anxiety depression initially decline time majority job time span succeed adapt psychosocially remain unemployed bad term wellbeing stressaffect moderate social support group migrant suffer longterm joblessness social support exert longitudinal buffer wave anxiety depression migrant neither hold job received support longitudinal causal status mainly negative complaint social support negative support turn reciprocal time,"['10.1037/0033-2909.98.2.310', '10.1016/0277-9536(87)90385-6', '10.1037/0003-066X.44.3.513', '10.1016/0191-8869(89)90125-6', '10.1177/0265407591081005']","['Cohen,1985,10.1037/0033-2909.98.2.310', 'Hobfoll,1989,10.1037/0003-066X.44.3.513']",1005,15,0.3324909806251526,0.10829287767410278,1.8111451906198957
10.1136/bmj.307.6912.1102,"Objective-To examine relations between stressful life events and mortality in middle aged men. Design-Prospective population study. Data on stressful life events, social network, occupation, and other psychosocial factors derived from self administered questionnaires. Mortality data obtained from official registers. Setting-City of Gothenburg, Sweden. Subjects-752 men from a random population sample of 1016 men aged 50. Main outcome measure-Mortality from all causes during seven years' follow up. Results-Life events which had occurred in the year before the baseline examination were significantly associated with mortality from all causes during seven years' follow up. Of the men who had experienced three or more events during the past year 10.9% had died compared with 3.3% among those with no life events (odds ratio 3.6; 95% confidence interval 1.5 to 8.5). The association between recent life events and mortality remained true after smoking, self perceived health, occupational class, and indices of social support were controlled for. Many of the deaths were alcohol related, but the number of deaths was too small to allow for analyses of specific causes of death. The association between life events and mortality was evident only in men with low emotional support. Conclusion-Stressful life events are associated with high mortality in middle aged men. Men with adequate emotional support seem to be protected.","STRESSFUL LIFE EVENTS, SOCIAL SUPPORT, AND MORTALITY IN MEN BORN IN 1933","ROSENGREN, A and ORTHGOMER, K and WEDEL, H and WILHELMSEN, L",1993,"[Anonymous], 1985, SAS users guide: Statistics and [Anonymous], 1982, Swedish Socioeconomic Classification and BERKMAN LF, 1979, AM J EPIDEMIOL, V109, P186, DOI 10.1093/oxfordjournals.aje.a112674 and Billings A., 1982, HEALTH PSYCHOL, V1, P99, DOI [10. 1037/0278-6133. 1. 2. 99, DOI 10.1037/0278-6133.1.2.99] and BRADLEY JV, 1968, DISTRIBUTION FREE ST, P68 and CASSEL J, 1976, AM J EPIDEMIOL, V104, P107, DOI 10.1093/oxfordjournals.aje.a112281 and COBB S, 1976, PSYCHOSOM MED, V38, P300, DOI 10.1097/00006842-197609000-00003 and DOHRENWEND BS, 1978, J HEALTH SOC BEHAV, V19, P205, DOI 10.2307/2136536 and FORSEN A, 1991, PSYCHOTHER PSYCHOSOM, V55, P176, DOI 10.1159/000288427 and GOLDBERG EL, 1976, AM J EPIDEMIOL, V104, P146, DOI 10.1093/oxfordjournals.aje.a112285 and HANEY CA, 1980, SOC SCI MED-MED SOC, V14, P119, DOI 10.1016/S0271-7123(80)80030-7 and HELSING KJ, 1981, AM J EPIDEMIOL, V114, P41, DOI 10.1093/oxfordjournals.aje.a113172 and HENDERSON S, 1980, PSYCHOL MED, V10, P723, DOI 10.1017/S003329170005501X and HOLLIS JF, 1990, J BEHAV MED, V13, P263, DOI 10.1007/BF00846834 and HOLME I, 1980, J EPIDEMIOL COMMUN H, V34, P48, DOI 10.1136/jech.34.1.48 and HOLMES TH, 1967, J PSYCHOSOM RES, V11, P213, DOI 10.1016/0022-3999(67)90010-4 and HOUSE JS, 1982, AM J EPIDEMIOL, V116, P123, DOI 10.1093/oxfordjournals.aje.a113387 and HOUSE JS, 1988, SCIENCE, V241, P540, DOI 10.1037/0003-066X.59.8.676 and JONES DR, 1987, J PSYCHOSOM RES, V31, P325, DOI 10.1016/0022-3999(87)90052-3 and KASL SV, 1984, ANNU REV PUBL HEALTH, V5, P319 and KLEINBAUM DG, 1982, EPIDEMIOLOGIC RES PR, P422 and KOBASA SC, 1981, J HEALTH SOC BEHAV, V22, P368, DOI 10.2307/2136678 and LUNDBERG U, 1975, J PSYCHOSOM RES, V19, P27, DOI 10.1016/0022-3999(75)90047-1 and MARMOT MG, 1991, LANCET, V337, P1387, DOI 10.1016/0140-6736(91)93068-K and MARMOT MG, 1984, LANCET, V1, P1003 and MCFARLANE AH, 1983, J HEALTH SOC BEHAV, V24, P160, DOI 10.2307/2136642 and MELLSTROM D, 1982, SCAND J SOC MED, V10, P33, DOI 10.1177/140349488201000201 and ORTHGOMER K, 1990, PSYCHOSOM MED, V52, P59, DOI 10.1097/00006842-199001000-00005 and ORTHGOMER K, 1987, J CHRON DIS, V40, P949, DOI 10.1016/0021-9681(87)90145-7 and RAHE RH, 1971, J PSYCHOSOM RES, V15, P33, DOI 10.1016/0022-3999(71)90071-7 and RAHE RH, 1973, AM J PSYCHIAT, V130, P1222, DOI 10.1176/ajp.130.11.1222 and RAHE RH, 1974, ARCH INTERN MED, V133, P221, DOI 10.1001/archinte.133.2.221 and ROSENGREN A, 1991, AM J CARDIOL, V68, P1171, DOI 10.1016/0002-9149(91)90189-R and ROSENGREN A, 1987, ACTA MED SCAND, V222, P201 and ROSENGREN A, 1990, BMJ-BRIT MED J, V300, P634, DOI 10.1136/bmj.300.6725.634 and ROSENGREN A, 1988, BMJ-BRIT MED J, V297, P1497, DOI 10.1136/bmj.297.6662.1497 and RUBERMAN W, 1984, NEW ENGL J MED, V311, P552, DOI 10.1056/NEJM198408303110902 and SLAP GB, 1991, J ADOLESCENT HEALTH, V12, P263, DOI 10.1016/0197-0070(91)90021-D and THEORELL T, 1975, INT J EPIDEMIOL, V4, P281, DOI 10.1093/ije/4.4.281 and Theorell T G, 1982, Adv Cardiol, V29, P140 and THIEL HG, 1973, J PSYCHOSOM RES, V17, P43, DOI 10.1016/0022-3999(73)90086-X and UNDEN AL, 1989, SOC SCI MED, V29, P1387, DOI 10.1016/0277-9536(89)90240-2 and WELIN L, 1985, LANCET, V1, P915 and WINSA B, 1991, LANCET, V338, P1475, DOI 10.1016/0140-6736(91)92298-G",1094,objectiveto relation stressful life event mortality middle age men designprospective population stressful life event social occupation psychosocial derive self administer questionnaire mortality official register settingcity gothenburg sweden subject men random population men age main measuremortality cause seven year resultslife event occur year baseline examination mortality cause seven year men experience event past year die life event ratio confidence interval life event mortality remain true smoke self perceived health class index social support control death alcohol death allow specific cause death life event mortality evident men emotional support conclusionstressful life event mortality middle age men men adequate emotional support seem protect,"['10.1093/oxfordjournals.aje.a112674', '10.', '10.1037/0278-6133.1.2.99', '10.1093/oxfordjournals.aje.a112281', '10.1097/00006842-197609000-00003', '10.2307/2136536', '10.1159/000288427', '10.1093/oxfordjournals.aje.a112285', '10.1016/S0271-7123(80)80030-7', '10.1093/oxfordjournals.aje.a113172', '10.1017/S003329170005501X', '10.1007/BF00846834', '10.1136/jech.34.1.48', '10.1016/0022-3999(67)90010-4', '10.1093/oxfordjournals.aje.a113387', '10.1037/0003-066X.59.8.676', '10.1016/0022-3999(87)90052-3', '10.2307/2136678', '10.1016/0022-3999(75)90047-1', '10.1016/0140-6736(91)93068-K', '10.2307/2136642', '10.1177/140349488201000201', '10.1097/00006842-199001000-00005', '10.1016/0021-9681(87)90145-7', '10.1016/0022-3999(71)90071-7', '10.1176/ajp.130.11.1222', '10.1001/archinte.133.2.221', '10.1016/0002-9149(91)90189-R', '10.1136/bmj.300.6725.634', '10.1136/bmj.297.6662.1497', '10.1056/NEJM198408303110902', '10.1016/0197-0070(91)90021-D', '10.1093/ije/4.4.281', '10.1016/0022-3999(73)90086-X', '10.1016/0277-9536(89)90240-2', '10.1016/0140-6736(91)92298-G']","['BERKMAN,1979,10.1093/oxfordjournals.aje.a112674', 'Henderson,1980,10.1017/S003329170005501X', 'Cohen,2004,10.1037/0003-066X.59.8.676']",1093,13,0.5464625954627991,0.17566412687301636,0.9932445889258464
10.2105/AJPH.82.8.1136,"The aim was to investigate whether job strain affects mortality in a representative population of elderly men, and whether social network and social support outside the workplace can buffer the negative health effects of job strain. A higher relative mortality risk (RR) was found among men exposed to job strain (RR = 1.7). The combination of exposure to job strain and seven different measures of weak social network and social support was associated with a further increased RR ranging from 2.1 to 4.6.","JOB STRAIN AND MORTALITY IN ELDERLY MEN - SOCIAL NETWORK, SUPPORT, AND INFLUENCE AS BUFFERS","FALK, A and HANSON, BS and ISACSSON, SO and OSTERGREN, PO",1992,"ALFREDSSON L, 1982, SOC SCI MED, V16, P463, DOI 10.1016/0277-9536(82)90054-5 and ALFREDSSON L, 1985, INT J EPIDEMIOL, V14, P378, DOI 10.1093/ije/14.3.378 and ALFREDSSON L, 1983, SOC SCI MED, V17, P1497, DOI 10.1016/0277-9536(83)90094-1 and ASTRAND NE, 1988, THESIS LUND U MALMO and BERKMAN LF, 1979, AM J EPIDEMIOL, V109, P186, DOI 10.1093/oxfordjournals.aje.a112674 and Hanson B., 1988, THESIS LUND U MALMO and HANSON BS, 1989, AM J EPIDEMIOL, V130, P100, DOI 10.1093/oxfordjournals.aje.a115301 and HANSON BS, 1987, SOC SCI MED, V25, P849, DOI 10.1016/0277-9536(87)90043-8 and JANZON L, 1986, J EPIDEMIOL COMMUN H, V40, P174, DOI 10.1136/jech.40.2.174 and JOHNSON JV, 1986, THESIS U STOCKHOLM S and KAPLAN GA, 1988, AM J EPIDEMIOL, V128, P370, DOI 10.1093/oxfordjournals.aje.a114977 and KARASEK R, 1981, AM J PUBLIC HEALTH, V71, P694, DOI 10.2105/AJPH.71.7.694 and KARASEK RA, 1979, ADMIN SCI QUART, V24, P285, DOI 10.2307/2392498 and KARASEK RA, 1988, AM J PUBLIC HEALTH, V78, P910, DOI 10.2105/AJPH.78.8.910 and LAROCCO JM, 1980, J HEALTH SOC BEHAV, V21, P202, DOI 10.2307/2136616 and SCHOENBACH VJ, 1986, AM J EPIDEMIOL, V123, P577, DOI 10.1093/oxfordjournals.aje.a114278 and SEEMAN TE, 1987, AM J EPIDEMIOL, V126, P714, DOI 10.1093/oxfordjournals.aje.a114711",1737,job strain mortality representative population elderly men social social support outside workplace buffer negative health job strain relative mortality risk rr men expose job strain rr combination exposure job strain seven weak social social support increase rr range,"['10.1016/0277-9536(82)90054-5', '10.1093/ije/14.3.378', '10.1016/0277-9536(83)90094-1', '10.1093/oxfordjournals.aje.a112674', '10.1093/oxfordjournals.aje.a115301', '10.1016/0277-9536(87)90043-8', '10.1136/jech.40.2.174', '10.1093/oxfordjournals.aje.a114977', '10.2105/AJPH.71.7.694', '10.2307/2392498', '10.2105/AJPH.78.8.910', '10.2307/2136616', '10.1093/oxfordjournals.aje.a114278', '10.1093/oxfordjournals.aje.a114711']","['BERKMAN,1979,10.1093/oxfordjournals.aje.a112674', 'Karasek,1979,10.2307/2392498']",1735,13,0.743615984916687,0.614697277545929,0.9509072518331029
